{
  "project": "로얄베이비 온라인 스토어 — 웹 와이어프레임 (역기획)",
  "index": true,
  "canvas": { "width": 375, "height": 812, "padding": 16, "gap": 12 },
  "screens": [
    {
      "id": "S01",
      "name": "사이즈 진단",
      "group": "진입",
      "note": "카탈로그를 먼저 보여주지 않는다. 부모의 실제 질문은 '어떤 모델'이 아니라 '몇 인치'이므로, 진단을 첫 화면에 둔다.",
      "blocks": [
        { "type": "nav", "label": "사이즈 찾기" },
        { "type": "text", "label": "아이 정보를 입력하면 맞는 사이즈를 알려드려요", "height": 40 },
        { "type": "input", "label": "아이 나이 (만 나이)" },
        { "type": "input", "label": "키 (cm)" },
        { "type": "input", "label": "인심 길이 (cm) · 선택" },
        { "type": "text", "label": "인심: 발바닥에서 사타구니 안쪽까지", "height": 20 },
        { "type": "button", "label": "사이즈 확인하기", "variant": "primary" },
        { "type": "divider" },
        { "type": "button", "label": "잘 모르겠어요, 전체 보기", "variant": "ghost" },
        { "type": "tabbar", "label": "홈 / 사이즈찾기 / 매장 / 마이" }
      ]
    },
    {
      "id": "S02",
      "name": "진단 결과",
      "group": "진입",
      "note": "결과를 하나만 제시하고 경계값일 때만 두 개를 보여준다. 선택지를 늘리면 진단의 의미가 사라진다.",
      "blocks": [
        { "type": "nav", "label": "진단 결과" },
        { "type": "hero", "label": "14인치가 맞아요", "height": 120 },
        { "type": "text", "label": "만 4세 / 105cm 기준 · 인심 44~52cm 권장", "height": 24 },
        { "type": "card", "label": "EZ 바이크 프로 14", "meta": ["14인치", "3~6세", "밸런스+페달링"], "action": "상세 보기", "items": 1 },
        { "type": "divider" },
        { "type": "text", "label": "키가 경계에 걸쳐요 · 16인치도 확인해보세요", "height": 24 },
        { "type": "card", "label": "EZ 바이크 프로 16", "meta": ["16인치", "5~8세"], "action": "상세 보기", "items": 1 },
        { "type": "tabbar", "label": "홈 / 사이즈찾기 / 매장 / 마이" }
      ]
    },
    {
      "id": "S03",
      "name": "제품 목록",
      "group": "탐색",
      "note": "필터 기본값을 진단 결과 사이즈로 미리 채운다. 진단을 거쳐온 사용자가 다시 조건을 입력하게 만들면 진단이 무의미해진다.",
      "blocks": [
        { "type": "nav", "label": "제품 목록" },
        { "type": "searchbar", "label": "모델명 검색" },
        { "type": "chips", "label": "사이즈: 14인치 / 색상 / 가격순" },
        { "type": "text", "label": "검색 결과 3개", "height": 20 },
        { "type": "card", "label": "EZ 바이크 프로 14 블루", "meta": ["14인치", "재고 있음"], "action": "장바구니", "items": 3 },
        { "type": "tabbar", "label": "홈 / 사이즈찾기 / 매장 / 마이" }
      ]
    },
    {
      "id": "S04",
      "name": "제품 상세",
      "group": "탐색",
      "note": "안전 인증을 상단에 배치한다. 부모의 구매 저항은 가격이 아니라 안전이므로, 스크롤 아래로 내리면 안 된다.",
      "blocks": [
        { "type": "nav", "label": "EZ 바이크 프로 14" },
        { "type": "image", "label": "제품 대표 컷", "height": 220 },
        { "type": "text", "label": "EZ 바이크 프로 14인치 · 블루", "height": 28 },
        { "type": "chips", "label": "블루 / 옐로우 / 핑크" },
        { "type": "table", "label": "권장 나이 · 권장 키 · 인심", "columns": 3, "items": 1 },
        { "type": "list", "label": "글로벌 인증 · V-BRAKE · 실드 베어링 · 높이 조절", "items": 4, "height": 44 },
        { "type": "row", "children": [
          { "type": "button", "label": "장바구니", "variant": "secondary" },
          { "type": "button", "label": "바로 구매", "variant": "primary" }
        ]},
        { "type": "tabbar", "label": "홈 / 사이즈찾기 / 매장 / 마이" }
      ]
    },
    {
      "id": "S05",
      "name": "검색 결과 없음",
      "group": "탐색",
      "note": "빈 화면에서 사용자를 멈추게 하지 않는다. 조건을 풀어주는 버튼과 진단으로 돌아가는 길을 함께 준다.",
      "blocks": [
        { "type": "nav", "label": "제품 목록" },
        { "type": "searchbar", "label": "모델명 검색" },
        { "type": "chips", "label": "사이즈: 12인치 / 색상: 핑크" },
        { "type": "spacer", "height": 80 },
        { "type": "text", "label": "조건에 맞는 제품이 없어요", "height": 32 },
        { "type": "text", "label": "색상 조건을 빼면 2개를 볼 수 있어요", "height": 24 },
        { "type": "button", "label": "색상 조건 해제", "variant": "primary" },
        { "type": "button", "label": "사이즈 다시 진단하기", "variant": "ghost" },
        { "type": "tabbar", "label": "홈 / 사이즈찾기 / 매장 / 마이" }
      ]
    }
  ]
}
